Category,Subcategory,Name,First_Appearance_Chapter,Description,Current_Status,Owner_User,Relationships,Cross_References,Notes,Last_Updated
Characters,Main,Uncle Matt,1,Bard/musician from Cedar Hollow, adventurer,Active,None,Bob (companion),Multiple chapters,Optimistic and musical personality,2025-09-23
Characters,Main,Bob the Magical Talking Turtle,1,Magical turtle companion to Matt,Active,None,Matt (companion),Multiple chapters,Wise and magical abilities,2025-09-23
Characters,Antagonists,Troll,1,Bridge troll demanding toll,Defeated,None,Matt and Bob,Chapter 1,Gruff green-skinned creature,2025-09-23
Characters,Allies,Baby Griffin,1,Injured orphaned griffin,Healed,None,Matt and Bob (rescuers),Chapter 1,Rescued from cave,2025-09-23
Characters,Allies,Mother Griffin,1,Griffin mother who rewards rescuers,Grateful,None,Matt and Bob,Chapter 1,Gives enchanted crystal,2025-09-23
Characters,Minor,Merchant,1,Grateful wagon merchant,Helped,None,Matt and Bob,Chapter 1,Provides honey candies and shortcut,2025-09-23
Characters,Antagonists,Zarak,2,Evil sorcerer mentioned by Everwood,Active,None,Dark forces,Chapter 2+,Enemy of the protagonists,2025-09-23
Characters,Allies,Everwood,2,Ancient forest guardian and mentor,Active,None,Matt and Bob (mentees),Chapter 2+,Provides guidance and aid,2025-09-23
Locations,Villages,Cedar Hollow,1,Uncle Matt's home village,Visited,None,Matt's origin,Chapters 1-2+,Peaceful farming community,2025-09-23
Locations,Forests,Dragon Wood,1,Cursed ancient forest,Explored,None,Contains evil forces,Chapters 1-2+,Dangerous with living trees,2025-09-23
Locations,Mountains,Iron Mountains,1,Distant mountains visible from Cedar Hollow,Visible,None,Morning backdrop,Chapter 1,Dramatic peaks at dawn,2025-09-23
Locations,Forests,Willow Woods,1,Peaceful forest with birds and squirrels,Passed through,None,Song inspiration,Chapter 1,Tranquil woodland path,2025-09-23
Locations,Meadows,Morning Meadows,1,Sunlit grasslands after Willow Woods,Passed through,None,Path to ridge,Chapter 1,Open grassy expanse,2025-09-23
Locations,Mountains,Misty Mountains,2,Mountain range with caves and giants,Explored,None,Giant attacks,Chapter 2+,Harsh terrain with threats,2025-09-23
Locations,Bridges,Stone Bridge,1,Wide stone bridge over deep ravine,Crossed,None,Troll toll encounter,Chapter 1,Guarded by troll,2025-09-23
Locations,Caves,Griffin Cave,1,Murky cave where baby griffin was found,Explored,None,Baby griffin rescue,Chapter 1,Dark crevasse in hillside,2025-09-23
Locations,Mountains,Giant's Teeth,2,Jagged peaks and treacherous paths,Crossed,None,Giant encounter,Chapter 2+,Dangerous climbing areas,2025-09-23
Artifacts,Weapons,Short Sword,2,Uncle Matt's blade,Active,Matt,None,Chapter 2+,Used in battles,2025-09-23
Artifacts,Food,Honey Candies,1,Tantalizing honey candies from merchant,Consumed,None,Merchant reward,Chapter 1,Reward for helping with wagon,2025-09-23
Artifacts,Magical,Enchanted Crystal,1,Gift from griffin mother for light magic,Active,Matt,None,Chapters 1-2+,Pierces darkness and repels evil,2025-09-23
Artifacts,Musical,Silver Lute,1,Uncle Matt's father's lute,Active,Matt,None,Chapters 1-2+,Used for music and magic,2025-09-23
Artifacts,Weapons,Oaken Staff,2,Bob's walking staff,Active,Bob,None,Chapter 2+,Magical turtle abilities,2025-09-23
Spaceship,Vehicle,Cosmos Cruiser,50,Fabled starship with alien artifacts,Active,Matt and Bob,None,Chapters 50+,Intergalactic travel vessel,2025-09-23
Spaceship,Components,Repulsion Gloves,50,Artifact for maneuvering in debris fields,Active,Cosmos Cruiser,None,Chapter 50+,Helps clear space debris,2025-09-23
Spaceship,Components,Starlight Communicator Arrays,50,Communication system for the ship,Active,Cosmos Cruiser,None,Chapter 50+,Alien communication tech,2025-09-23
Spaceship,Components,Temporal Telescope,50,Chronal archives and viewing device,Active,Cosmos Cruiser,None,Chapter 50+,Time/space observation tool,2025-09-23
Spaceship,Components,Gravitational Manipulation Systems,50,For moving habitats and objects,Active,Cosmos Cruiser,None,Chapter 50+,Mass manipulation technology,2025-09-23
Spaceship,Components,Transmat Beams,50,Transportation technology,Active,Cosmos Cruiser,None,Chapter 50+,Matter transmission,2025-09-23
Spaceship,Components,Dissociation Array,50,Phasing through dimensions,Active,Cosmos Cruiser,None,Chapter 50+,Space-time manipulation,2025-09-23
Spaceship,Components,Relativistic Physics Paradox Engines,50,Stealth and time-shifting,Active,Cosmos Cruiser,None,Chapter 50+,Advanced propulsion,2025-09-23
Spaceship,Components,Primordial Particle Infusion,50,Fuel system,Active,Cosmos Cruiser,None,Chapter 50+,Exotic matter fuel,2025-09-23
Spaceship,Components,Carver Consoles,50,Navigation controls,Active,Cosmos Cruiser,None,Chapter 50+,Alien navigation interface,2025-09-23
Spaceship,Components,Resonant Navigation Crystals,50,Harmonic navigation,Active,Cosmos Cruiser,None,Chapter 50+,Crystal-based steering,2025-09-23
Spaceship,Components,Solarite Sword,50,Energy weapon from ship,Active,Cosmos Cruiser,None,Chapter 50+,Powerful blade artifact,2025-09-23
Spaceship,Components,Astral Shield,50,Protective barrier,Active,Cosmos Cruiser,None,Chapter 50+,Energy defense system,2025-09-23
Spaceship,Components,Quantoharp,50,Musical instrument with power,Active,Matt,None,Chapter 50+,Harmonic weapon/tool,2025-09-23
Spaceship,Components,Luminescent Crystal Chandeliers,50,Interior lighting system,Active,Cosmos Cruiser,None,Chapter 50,Crystal-based illumination,2025-09-23
Spaceship,Components,Mithril Helm Console,50,Command deck control interface,Active,Cosmos Cruiser,None,Chapter 50,Mithril-finished console,2025-09-23
Spaceship,Components,Alien Sigils,50,Wall engravings with ship history,Active,Cosmos Cruiser,None,Chapter 50,Intricate alien inscriptions,2025-09-23
Spaceship,Components,Luminescent Frescoes,50,Ceiling paintings from thousand worlds,Active,Cosmos Cruiser,None,Chapter 50,Glowing artwork collection,2025-09-23
Spaceship,Components,Zeta Reticuli Cybernetic Plants,50,Air purification system,Active,Cosmos Cruiser,None,Chapter 50,Alien plant life support,2025-09-23
Spaceship,Components,Betelgeuse Molecular Assemblers,50,Food fabrication technology,Active,Cosmos Cruiser,None,Chapter 50,Exotic cuisine synthesizer,2025-09-23
Spaceship,Components,Alpha Centauri Incense Burners,50,Air fragrance system,Active,Cosmos Cruiser,None,Chapter 50,Aromatic atmosphere control,2025-09-23
Spaceship,Components,Auto-Servants,50,Automated maintenance systems,Active,Cosmos Cruiser,None,Chapter 50,Ghostly garden tenders,2025-09-23
Spaceship,Components,Orichalcum Walls,50,Ship hull material,Active,Cosmos Cruiser,None,Chapter 50,Smooth metallic construction,2025-09-23
Spaceship,Components,Crystalline Viewports,50,Observation windows,Active,Cosmos Cruiser,None,Chapter 50,Transparent viewing portals,2025-09-23
Spaceship,Components,Star Charts,50,Navigation database,Active,Cosmos Cruiser,None,Chapter 50,Astronomical mapping data,2025-09-23
Spaceship,Components,Language Matrix,50,Universal translation system,Active,Cosmos Cruiser,None,Chapter 50,Automatic communication translator,2025-09-23
Spaceship,Components,Stellar Cartography Display,50,Real-time mapping interface,Active,Cosmos Cruiser,None,Chapter 50,Dynamic star system charts,2025-09-23
Spaceship,Components,Panoramic Viewports,50,Large observation windows,Active,Cosmos Cruiser,None,Chapter 50,Expansive viewing domes,2025-09-23
Spaceship,Components,Probability Arc,50,Navigation plotting tool,Active,Cosmos Cruiser,None,Chapter 50,Course calculation device,2025-09-23
Spaceship,Components,Ship's Codex,50,Ancient database and archives,Active,Cosmos Cruiser,None,Chapter 50,Cosmic knowledge repository,2025-09-23
Spaceship,Components,Xenolinguistic Data Cores,50,Language database system,Active,Cosmos Cruiser,None,Chapter 50,Alien linguistics storage,2025-09-23
Spaceship,Components,Cultural Anthropology Archives,50,Cultural knowledge database,Active,Cosmos Cruiser,None,Chapter 50,Civilization studies repository,2025-09-23
Spaceship,Components,Matrix Core,50,Bob's cybernetic storage system,Active,Bob,None,Chapter 50,Data storage for turtle companion,2025-09-23
Spaceship,Components,Resonance Fields,50,Stabilizing energy fields,Active,Cosmos Cruiser,None,Chapter 50,Harmonic ship stabilization,2025-09-23
Spaceship,Components,Long-Range Stealth Systems,50,Cloaking and stealth technology,Active,Cosmos Cruiser,None,Chapter 50,Advanced concealment systems,2025-09-23
Spaceship,Components,Transmat Beam,50,Transportation technology,Active,Cosmos Cruiser,None,Chapter 50,Matter transmission system,2025-09-23
Spaceship,Components,Cybernetic Neural Core,50,Bob's neural interface system,Active,Bob,None,Chapter 50,Data processing and navigation,2025-09-23
Timeline,Early Journey,Departure from Cedar Hollow,1,Matt leaves home to seek adventure,Ongoing,None,None,Chapter 1,Start of the quest,2025-09-23
Timeline,Early Journey,Reunion with Bob,1,Matt finds Bob the turtle in campsite,Ongoing,None,None,Chapter 1,Serendipitous meeting,2025-09-23
Timeline,Early Journey,Troll Bridge Encounter,1,Defeat troll guarding stone bridge,Resolved,None,None,Chapter 1,Music puts troll to sleep,2025-09-23
Timeline,Early Journey,Baby Griffin Rescue,1,Heal injured griffin and receive crystal reward,Completed,None,None,Chapter 1,Matt splints wing, Bob sings lullaby,2025-09-23
Timeline,Early Journey,Merchant Wagon Rescue,1,Help merchant right overturned wagon,Completed,None,None,Chapter 1,Receive honey candies and shortcut,2025-09-23
Timeline,Early Journey,Enter Dragon Wood,1,Choose to enter cursed forest despite dangers,Ongoing,None,None,Chapter 1,Drawn by promise of mysteries,2025-09-23
Timeline,Early Journey,Goblin Ambush,2,Attack by goblin pack in caves,Resolved,None,None,Chapter 2,First major battle,2025-09-23
Timeline,Early Journey,Giant Attack,2,Battle with mountain giant,Resolved,Everwood saves them,None,Chapter 2,Everwood's first appearance,2025-09-23
Timeline,Space Travel,Cosmos Cruiser Discovery,50,Finding the ancient starship,Active,None,None,Chapter 50,Transition to space opera,2025-09-23
Timeline,Space Travel,Refugee Rescue,50,Saving habitats from dying star,Completed,None,None,Chapter 50,First space mission,2025-09-23
Relationships,Alliances,Matt and Bob Companionship,1,Deep friendship and partnership,Ongoing,None,Chapter 1,Core relationship,2025-09-23
Relationships,Mentorship,Everwood as Mentor,2,Ancient guardian guides protagonists,Ongoing,None,Chapter 2+,Provides wisdom and aid,2025-09-23
Relationships,Antagonism,Zarak vs Protagonists,2,Evil sorcerer opposes heroes,Ongoing,None,Chapter 2+,Dark forces threat,2025-09-23
Cross_References,Artifact Usage,Crystal Power,1,Used against tree demon and goblins,Consistent,None,Chapters 1-2,Light magic weapon,2025-09-23
Cross_References,Character Development,Matt's Musical Abilities,1,Used for combat and entertainment,Consistent,None,Chapter 1,Signature ability,2025-09-23
Cross_References,Location Connections,Cedar Hollow to Dragon Wood,1,Journey path established,Consistent,None,Chapter 1,Travel route,2025-09-23
Timeline,Early Journey,Tree Demon Battle,1,Major battle using crystal power against animated roots,Resolved,None,Matt and Bob vs tree demon,Chapter 1,Crystal's first major power display,2025-09-23
Artifacts,Travel Gear,Feathered Cap and Cloak,1,Matt's travel clothing for the journey,Active,Matt,None,Chapter 1,Worn when departing Cedar Hollow,2025-09-23
Artifacts,Food,Wild Brambleberries,1,Gift from Bob to Matt at reunion,Consumed,None,Bob (giver) Matt (receiver),Chapter 1,Token of friendship renewed,2025-09-23
Artifacts,Food,Traveling Supplies,1,Matt's provisions: cheese bread dried venison honey vial,Consumed,Matt,None,Chapter 1,Journey preparations,2025-09-23
Characters,Antagonists,Mysterious Creature,1,Silent figure with crystal shard who destroys tree bridge,Active,None,Crystal shard wielder,Chapter 1,Hidden antagonist watching Matt and Bob,2025-09-23
Locations,Magical,Enchanted Hedge Maze,1,Shifting maze where Bob got lost before meeting Matt,Passed through,None,Bob's backstory,Chapter 1,Paths shift inexplicably without pattern,2025-09-23
Locations,Natural,Stream/Gorge,1,Water crossing in Dragon Wood with fallen tree bridge,Explored,None,Bridge destruction site,Chapter 1,Strong muddy current through gorge,2025-09-23
Locations,Natural,Plains Beyond Dragon Wood,1,Vast windswept grasslands visible from forest edge,Viewed,None,Chapter endpoint vista,Chapter 1,Pristine beauty and potential,2025-09-23
Artifacts,Weapons,Wooden Club,1,Troll's weapon for threatening travelers,Active,Troll,None,Chapter 1,Used to slam ground for emphasis,2025-09-23
Artifacts,Tools,Chalk,1,Matt's tool for marking trees to avoid getting lost,Used,Matt,None,Chapter 1,Small sigils marked on trees,2025-09-23
Artifacts,Magical,Crystal Shard,1,Mysterious creature's artifact used to destroy bridge,Active,Mysterious Creature,None,Chapter 1,Glistening crystal on cord around neck,2025-09-23
Artifacts,Written,Farewell Note,1,Matt's goodbye message to Cedar Hollow villagers,Left behind,None,Village farewell,Chapter 1,Pinned to door explaining departure,2025-09-23
Artifacts,Tools,Map,1,Navigation reference consulted at stream crossing,Active,Matt and Bob,None,Chapter 1,Shows no water crossing indication,2025-09-23
Artifacts,Camping,Bedrolls,1,Sleeping equipment for camping in Dragon Wood,Active,Matt and Bob,None,Chapter 1,Used during night watch shifts,2025-09-23
Timeline,Early Journey,Stream Bridge Destruction,1,Mysterious creature destroys fallen tree crossing,Completed,Mysterious Creature,None,Chapter 1,Sabotage after Matt and Bob cross,2025-09-23
Characters,Antagonists,Goblins,2,Pack of attacking creatures with crude weapons,Defeated,None,Pack leader and wolves,Chapter 2,Shadow-born beasts with stone weapons,2025-09-23
Characters,Antagonists,Pack Leader Goblin,2,Largest goblin leading the pack attack,Defeated,None,Goblin pack commander,Chapter 2,Leered down from fearsome wolf mount,2025-09-23
Characters,Antagonists,Giant,2,Mountain creature with triangular yellow eyes,Defeated,None,Everwood defeats it,Chapter 2,Thick stony hide and massive club,2025-09-23
Artifacts,Weapons,Goblin Crude Axes and Stone Blades,2,Primitive weapons brandished by goblin pack,Destroyed,Goblins,None,Chapter 2,Crude axes and blades of stone,2025-09-23
Artifacts,Weapons,Giant's Club,2,Massive weapon used by mountain giant,Destroyed,Giant,None,Chapter 2,Knocked off cliff edge by breeze,2025-09-23
Artifacts,Weapons,Everwood's Massive Oaken Staff,2,Legendarily powerful staff with lightning magic,Active,Everwood,None,Chapter 2,Carved staff that splits stone,2025-09-23
Locations,Natural,Cave Shelter,2,Rocky outcropping with caves for shelter,Explored,None,Goblin ambush site,Chapter 2,Ten paces deep half as wide sandy floor,2025-09-23
Characters,Antagonists,Jhilsara Farcaryn,3,The Mistress of the Night witch with ancient evil,Defeated,None,Willowdale curse caster,Chapter 3,Notorious witch dwelling in Cinder Woods,2025-09-23
Characters,Allies,Riga,3,Skilled healer and wise-woman of Willowdale,Deceased,Willowdale,Village healer,Chapter 3,Died from witch's curse before Matt arrived,2025-09-23
Characters,Minor,Stooped Older Lady,3,Village woman who explains curse to Matt,Helpful,Willowdale,Curse informant,Chapter 3,Nervous woman with small bundle,2025-09-23
Locations,Villages,Willowdale,3,Village afflicted by witch's curse,Liberated,None,Curse site,Chapter 3,Close-knit community with feverish plague,2025-09-23
Locations,Forests,Cinder Woods,3,Accursed forest where Jhilsara dwells,Explored,None,Witch's domain,Chapter 3,Gnarled ancient trees with twisted branches,2025-09-23
Locations,Natural,River Valley,3,Expansive valley where smoke was first seen,Passed through,None,Journey path,Chapter 3,Silver thread of water sparkling in sunlight,2025-09-23
Locations,Buildings,Jhilsara's Cottage,3,Dark gnarled cottage at center of clearing,Destroyed,Jhilsara,Witch's lair,Chapter 3,Ramshackle hut with fetid smoke tendrils,2025-09-23
Locations,Magical,Enchanted Pool Glade,3,Sacred pool where Bob was revived,Visited,None,Revival site,Chapter 3,Secluded moonlit glade with pristine waters,2025-09-23
Timeline,Magical Events,Witch's Curse on Willowdale,3,Three-day plague bringing feverish dreams,Resolved,Jhilsara,Curse victims,Chapter 3,Mysterious sickness with paralysis,2025-09-23
Timeline,Major Battles,Battle with Jhilsara,3,Confrontation with witch in her cottage,Completed,Matt and Bob,Witch defeat,Chapter 3,Crystal light vs ancient evil,2025-09-23
Timeline,Magical Events,Bob's Death and Revival,3,Bob killed by witch then revived in pool,Completed,Everwood assists,Life restoration,Chapter 3,Sacrifice and magical resurrection,2025-09-23
Characters,Allies,Emeritus,4,High sage of the underwater Triumvirate,Active,Underwater City,Turtle sage leader,Chapter 4,Ancient turtle with resonant watery voice,2025-09-23
Characters,Allies,Antiquus,4,Venerable keeper of collected knowledge,Active,Underwater City,Knowledge keeper,Chapter 4,Wise turtle sage with raspy aged voice,2025-09-23
Characters,Allies,Vaticus,4,Sage who scans currents of future fates,Active,Underwater City,Future seer,Chapter 4,Prophetic turtle sage,2025-09-23
Characters,Allies,Captain Runa,4,Affable halfling ship captain,Active,The Emerald Gannet,Ship commander,Chapter 4,Gap-toothed grin and 600 years experience,2025-09-23
Characters,Minor,Ship's Crew,4,Seasoned sailors on The Emerald Gannet,Active,The Emerald Gannet,Ship crew,Chapter 4,Eccentric but experienced seafarers,2025-09-23
Characters,Antagonists,Robots,4,Hulking and spider-like mechanical attackers,Defeated,Future timeline,Automated threats,Chapter 4,Red optics and spiked cudgels,2025-09-23
Locations,Magical,Passage of Ages,4,Ancient pillars with strange enchantments,Explored,None,Portal site,Chapter 4,Towering stone columns with runes,2025-09-23
Locations,Futuristic,Future City,4,Towering futuristic metropolis with flying vehicles,Visited,Portal access,Time vision,Chapter 4,Sleek metallic vehicles and crystal towers,2025-09-23
Locations,Magical,Stone Dais,4,Circle of seven columns with portal rune,Used,Portal magic,Transportation,Chapter 4,Raised platform with massive central rune,2025-09-23
Locations,Futuristic,High-tech Complex,4,Sprawling factories and foundries complex,Observed,Future timeline,Industrial site,Chapter 4,Thick smoke and fortified perimeter,2025-09-23
Locations,Magical,Underwater City,4,Glowing domed city of coral gold and pearl,Visited,Turtle sages,Sage meeting,Chapter 4,Preserved underwater metropolis,2025-09-23
Locations,Natural,Ocean,4,Vast shimmering expanse with azure waters,Traveled,None,Journey path,Chapter 4,Endless blue horizon and salty air,2025-09-23
Artifacts,Magical,Portal Rune,4,Massive central rune carved into stone dais,Used,Ancient magic,Time travel,Chapter 4,Thrice Matt's height portal doorway,2025-09-23
Artifacts,Magical,Star-Song Scepter,4,Ornate scepter with opalescent radiance,Active,Bob,Sage gift,Chapter 4,Channels arcane insights from beyond,2025-09-23
Artifacts,Magical,Dimension Blade,4,Glittering sword haloed in argent flame,Active,Matt,Sage gift,Chapter 4,Cleaves seams between worlds,2025-09-23
Artifacts,Magical,Melody Box,4,Ornate abalone shell box with pearl motifs,Active,Matt and Bob,Sage gift,Chapter 4,Channels rhythm underlying creation,2025-09-23
Artifacts,Vehicles,The Emerald Gannet,4,Trade ship bound across the sea,Active,Captain Runa,Sea transport,Chapter 4,Nimble ship with protective wards,2025-09-23
Artifacts,Weapons,Harpoon Gun,4,Ship weapon used against kraken,Used,Ship crew,Sea battle,Chapter 4,Stern-mounted projectile weapon,2025-09-23
Timeline,Magical Events,Portal to Future City,4,Time travel through ancient stone portal,Completed,Crystal amulet,Dimensional travel,Chapter 4,Vision of potential future timeline,2025-09-23
Timeline,Major Battles,Robot Attack,4,Battle with mechanical enemies from future,Completed,Matt and Bob,Future conflict,Chapter 4,Hulking and spider robots defeated,2025-09-23
Timeline,Major Battles,Kraken Battle,4,Epic sea monster fight during storm,Completed,Matt and Bob crew,Ocean combat,Chapter 4,Legendary defeat of oceanic terror,2025-09-23
Timeline,Magical Events,Meeting Turtle Sages,4,Underwater encounter with ancient wisdom,Completed,Triumvirate sages,Knowledge gained,Chapter 4,Received magical artifacts and guidance,2025-09-23
Characters,Allies,Dragon,5,Ancient serpentine creature with flame wings,Active,Volcanic lair,Wisdom keeper,Chapter 5,Lambent green eyes and jewel-crusted form,2025-09-23
Locations,Natural,Volcanic Range,5,Dark jagged peaks with magma tongues,Explored,None,Dragon's domain,Chapter 5,Seething monument of primal fury,2025-09-23
Locations,Natural,Caldera,5,Sheer inner valley around volcanic cone,Explored,None,Crater descent,Chapter 5,Churning lava below dizzying cliffs,2025-09-23
Locations,Natural,Dragon's Lair,5,Mammoth cavern within volcanic depths,Visited,Dragon,Wisdom meeting,Chapter 5,Hidden chamber with high spire,2025-09-23
Locations,Natural,Ancient Forest,5,Old forest untouched by ax or saw,Traveled,None,Journey path,Chapter 5,Hoary pines and firs with lichen tapestries,2025-09-23
Timeline,Magical Events,Volcano Exploration,5,Journey into dangerous volcanic realm,Completed,Matt and Bob,Adventure quest,Chapter 5,Descent into caldera seeking dragon,2025-09-23
Timeline,Magical Events,Dragon Encounter,5,Meeting with ancient dragon sage,Completed,Dragon,Wisdom exchange,Chapter 5,Cosmic conversation about trials ahead,2025-09-23
Locations,Magical,Tranquil Grove,7,Hidden magical sanctuary tended by sprites,Visited,None,Sprite sanctuary,Chapter 7,Only shows itself when least expected,2025-09-23
Characters,Magical,Sprite,7,Tiny winged girl with flowing silver hair,Active,Tranquil Grove,Bob (dance partner),Chapter 7,Delicate patterns on limbs and translucent wings,2025-09-23
Characters,Magical,Sprite Queen,7,Serene robed woman statue with jade eyes,Revered,Tranquil Grove,Sacred spring source,Chapter 7,Alabaster statue adorned with flower garlands,2025-09-23
Locations,Magical,Mother Tree,7,Colossal tree with carved history,Visited,None,Grove centerpiece,Chapter 7,Records history of land and people in carvings,2025-09-23
Artifacts,Magical,Sprite-chime,7,Tiny shell and metal wind chime gift,Active,Bob,Sprite blessing,Chapter 7,Gift from sprite for kindness and joy brought,2025-09-23
Locations,Forests,Whispering Woods,8,Ancient forest where nature sings with cosmos,Explored,None,Portal location,Chapter 8,Thick with scent of moss and ancient trees,2025-09-23
Locations,Magical,Celestial Portal,8,Dormant portal with cosmic symbols,Activated,None,Starlight gateway,Chapter 8,Ancient stones inscribed with cosmic symbols,2025-09-23
Artifacts,Magical,Universe Scope,8,Cosmic viewing device worn by Matt,Active,Matt,Celestial alignments,Chapter 8,Flickers with celestial pattern alignments,2025-09-23
Locations,Magical,Celestial Realm,8,Dreamscape where reality dances with stars,Visited,None,Portal destination,Chapter 8,Landscape woven from dreams and melodies,2025-09-23
Locations,Magical,Tree of Celestial Knowledge,8,Silvery tree with golden leaves and glowing fruit,Visited,None,Wisdom source,Chapter 8,Fruits impart cosmic wisdom when consumed,2025-09-23
Locations,Villages,Goodhollow,9,Prosperous town celebrating harvest festival,Visited,None,Haven of light,Chapter 9,Golden light from windows and chimney smoke,2025-09-23
Characters,Artificial,Oracle,9,Artificial brain in Difference Engine,Reformed,None,Bob (teacher),Chapter 9,Mechanical thinking device with lodestone core,2025-09-23
Characters,Antagonists,Architects Guild,9,Robed engineers creating dangerous automaton,Defeated,None,Oracle creators,Chapter 9,Secret cult manipulating volatile forces,2025-09-23
Characters,Antagonists,High Engineer,9,Leader of the Architects Guild,Defeated,Architects Guild,Guild commander,Chapter 9,Led ritual to activate lodestone resonator,2025-09-23
Locations,Towns,Crossroads Town,10,Bustling melting pot where cultures mingle,Visited,None,Cultural hub,Chapter 10,Vibrant marketplace with diverse peoples,2025-09-23
Locations,Commercial,Market Square,10,Central plaza with fountain and vendors,Explored,None,Town center,Chapter 10,Jewel-toned fabric stalls and exotic wares,2025-09-23
Characters,Minor,Ancient Beggar Woman,10,Mysterious elderly woman with keen eyes,Helpful,None,Cryptic advisor,Chapter 10,Disappeared mysteriously leaving copper penny,2025-09-23
Characters,Antagonists,Thief,10,Lean cloaked figure who stole silver,Escaped,None,Stolen from merchant,Chapter 10,Fleet of foot dark-cloaked criminal,2025-09-23
Timeline,Magical Events,Sprite Blessing,7,Bob receives sprite-chime gift,Completed,Sprite,Bob's reward,Chapter 7,Token for kindness and joy brought to grove,2025-09-23
Timeline,Magical Events,Portal Activation Ritual,8,Awakening celestial portal with artifacts,Completed,Matt and Bob,Cosmic gateway,Chapter 8,Symphony of melodies and light alignments,2025-09-23
Timeline,Major Battles,Oracle Reformation,9,Converting Difference Engine to moral purpose,Completed,Bob and Oracle,Conscience awakening,Chapter 9,Bob instills empathy and free thought,2025-09-23
Timeline,Social Events,Market Performance,10,Musical performance in town square,Completed,Matt and Bob,Cultural connection,Chapter 10,Song about music's universal language,2025-09-23
V E R I F I C A T I O N _ S T A T U S , C h a p t e r s   1 - 1 5 , C o m p l e t e , 2 0 2 5 - 0 1 - 2 8 , I n i t i a l   A g e n t , 1   c r i t i c a l   i n c o n s i s t e n c y   f o u n d   ( B o b   s h e l l ) , R e a d y   f o r   c h a p t e r s   1 6 - 3 0  
 V E R I F I C A T I O N _ S T A T U S , C h a p t e r s   1 6 - 3 0 , C o m p l e t e , 2 0 2 5 - 0 1 - 2 8 , E v i d e n c e - B a s e d   V e r i f i e r , 0   i n c o n s i s t e n c i e s   f o u n d , R e a d y   f o r   c h a p t e r s   3 1 - 4 5  
